{
  "schema_version": "rsih.q29b-runtime.v1",
  "packet_id": "q29b-merge-pair-0001",
  "family": "merge",
  "run": {
    "mode": "replay",
    "side": "baseline",
    "run_id": "run-merge-pair-0001",
    "attempt": 1,
    "adapter_ref": {
      "id": "rsih.fake-runtime-adapter",
      "version": 1,
      "digest": "sha256:b61822af49ed662c6e882237e1e85b27b3ead0f18869a079d9ba5a7697217803"
    },
    "profile_ref": {
      "id": "rsih.replay-profile",
      "version": 1,
      "digest": "sha256:536aa4b6b9489674b74ba2daa169650346f08911a0410a99b0d0e59a4716fb09"
    }
  },
  "sealed_inputs": {
    "segment_refs": [
      {
        "schema_version": "host.segment-ref.v1",
        "room_id": "room-alpha-0001",
        "segment_id": "seg-success-0001",
        "segment_version": 1,
        "segment_digest": "sha256:ad3b6ad01798de10110a69a14f789c812c7395e3f1e26f4ea2a99f10abdd7cb2",
        "evidence_seal_ref": {
          "id": "evseal-seg-success-0001",
          "version": 1,
          "digest": "sha256:4e5e12a6dc91986afb4b61a5104b271f9ec9e33856a085baf0e5022a1a485290"
        },
        "path_seal_ref": {
          "id": "pathseal-seg-success-0001",
          "version": 1,
          "digest": "sha256:15956a54e283a6660096710d67fd88d8d561b7220c337c0a91be6370b3790576"
        }
      }
    ],
    "path_refs": [
      {
        "path_id": "path-success-0001",
        "domain": "success",
        "segment_id": "seg-success-0001",
        "path_seal_ref": {
          "id": "pathseal-seg-success-0001",
          "version": 1,
          "digest": "sha256:15956a54e283a6660096710d67fd88d8d561b7220c337c0a91be6370b3790576"
        }
      }
    ],
    "artifact_ref": {
      "schema_version": "gms.skill-artifact-ref.v1",
      "lineage_id": "skill-beta",
      "version": 2,
      "kind": "step_guidance",
      "artifact_digest": "sha256:cee39cecbcdf53f736d8b32026858bf60f065cbbf47a000d9ff7f5947ec3fddc"
    },
    "required_path_domains": [
      "success"
    ]
  },
  "environment": {
    "locale": "en_US_POSIX",
    "timezone": "UTC",
    "network": "disabled",
    "cache": "per-run-isolated",
    "workdir": "/fake-workdir/q29b-merge-pair-0001"
  },
  "capabilities": {
    "clock": {
      "kind": "fake-sequence",
      "unit": "logical-tick",
      "ticks": [
        1000,
        1001,
        1002,
        1003
      ]
    },
    "random": {
      "kind": "fake-sequence",
      "unit": "uint32",
      "draws": [
        7
      ]
    },
    "tool": {
      "kind": "fake-responses",
      "responses": [
        {
          "call_index": 0,
          "tool_name": "memory_explore",
          "status": "succeeded",
          "upstream_result_digest": "sha256:851bf4a9379e418bed15e6fe57e11ec66a92d5a34c0230d7c9de91438ecc55a1",
          "response_digest": "sha256:dee29306b8651904d26276e51eda666f435118789d272c995ae6c5fa5bd2bec6"
        }
      ]
    },
    "provider": {
      "kind": "fake-responses",
      "responses": [
        {
          "call_index": 0,
          "model_id": "fake-model-1",
          "status": "succeeded",
          "content_digest": "sha256:0d366e33a51d114bac909eee3ac3b8799502c55b47d8b3225ba7ab81320d42e6",
          "content": "recorded provider completion for baseline run"
        }
      ]
    },
    "filesystem": {
      "kind": "fake-tree",
      "entries": [
        {
          "path": "/fake-workdir/q29b-merge-pair-0001/state.json",
          "node_type": "file",
          "content_digest": "sha256:84b2e7f1272675113958ec58ea3cad47442cb1a41b9c7ec07e24720342f51f51",
          "size_bytes": 47
        }
      ]
    }
  },
  "call_sequence": [
    {
      "step": 1,
      "capability": "clock",
      "operation": "read_tick"
    },
    {
      "step": 2,
      "capability": "provider",
      "operation": "complete",
      "call_index": 0,
      "model_id": "fake-model-1"
    },
    {
      "step": 3,
      "capability": "tool",
      "operation": "invoke",
      "call_index": 0,
      "tool_name": "memory_explore"
    },
    {
      "step": 4,
      "capability": "filesystem",
      "operation": "read",
      "path": "/fake-workdir/q29b-merge-pair-0001/state.json"
    },
    {
      "step": 5,
      "capability": "random",
      "operation": "draw"
    },
    {
      "step": 6,
      "capability": "clock",
      "operation": "read_tick"
    }
  ],
  "terminal": {
    "status": "succeeded",
    "reason_code": null,
    "completed_step": 6,
    "failing_step": null
  },
  "expected": {
    "outcome": "accept",
    "run_status": "succeeded",
    "reason_code": null,
    "output_digest": "sha256:1a625466e9c9da640d3d8826239d3e1b936ba8a4f9c1b35b3513b02b6b06f22e"
  }
}
